{
  "schema_version": "attribution/v1",
  "task_run_id": "task_run_9f2c9c2e",
  "phase_run_id": "phase_run_01",
  "lane_id": "lane-42",
  "intent_id": "intent-abc",
  "agent": "claude",
  "binding_method": "pre_assigned_session_id",
  "session_id": "11111111-1111-4111-8111-111111111111",
  "bound_at": "2026-08-01T09:00:00Z",
  "binding_status": "bound"
}
