{
  "schema_version": "attribution/v1",
  "task_run_id": "task_run_9f2c9c2e",
  "lane_id": "lane-42",
  "intent_id": "intent-abc",
  "agent": "claude",
  "binding_method": "manual_bind",
  "session_id": "33333333-3333-4333-8333-333333333333",
  "bound_at": "2026-08-01T09:10:00Z",
  "binding_status": "bound",
  "actor": { "kind": "human" }
}
